{
  "schema_version": 1,
  "kind": "tastecheck-public-release-status",
  "target_release": "1.5.0",
  "source_tree_sha256": "0dde29bb8c930be9728a56ba6b3bdca58e353b48360e1181a35b50f4bcef74d7",
  "manifest": {
    "id": "release-manifest",
    "path": "contracts/v1/release-receipts.json",
    "sha256": "079c9a5034690af753728c3d3a70757f03187a78a64694d6e65c3f1b0ae7abdf"
  },
  "claims": [
    {
      "id": "engineering",
      "status": "pass",
      "evidence": [
        {
          "id": "context-budget",
          "path": "evals/receipts/v1/context-budget.json",
          "sha256": "f2103ce4b444721bd0238c77a31d82049a46c98b9f9deb029a768339f2431e88"
        },
        {
          "id": "browser",
          "path": "evals/receipts/v1/browser.json",
          "sha256": "bd6ebfc1d9e917555ceaae29c42f0d0c819d3b185de393ea15a7f216102c9aa3"
        },
        {
          "id": "e2e",
          "path": "evals/receipts/v1/e2e.json",
          "sha256": "6281255c7fe7045bd1cf9d0f9680cea82cb643aec3c1cf3f4023b8c2824ae935"
        },
        {
          "id": "mechanical",
          "path": "evals/receipts/v1/mechanical.json",
          "sha256": "d458006aa7ee138e88e5454040497ce617c8a247c2cb28999f7fe9c3a7f411fe"
        },
        {
          "id": "security",
          "path": "evals/receipts/v1/security.json",
          "sha256": "b4d358bccceb0dd7ff57905acc14cd8794d085adc7aaa00a8cf4d9bd3ab435e0"
        },
        {
          "id": "clean-clone",
          "path": "evals/receipts/v1/clean-clone.json",
          "sha256": "4c1f16644f5cf7968a9f3c3b2d1ee03c51c3a3270ce459cfedf78deef8d90c1f"
        }
      ],
      "reasons": []
    },
    {
      "id": "browser",
      "status": "pass",
      "evidence": [
        {
          "id": "browser",
          "path": "evals/receipts/v1/browser.json",
          "sha256": "bd6ebfc1d9e917555ceaae29c42f0d0c819d3b185de393ea15a7f216102c9aa3"
        }
      ],
      "reasons": []
    },
    {
      "id": "accessibility",
      "status": "pass",
      "evidence": [
        {
          "id": "browser",
          "path": "evals/receipts/v1/browser.json",
          "sha256": "bd6ebfc1d9e917555ceaae29c42f0d0c819d3b185de393ea15a7f216102c9aa3"
        }
      ],
      "reasons": []
    },
    {
      "id": "effectiveness",
      "status": "blocked",
      "evidence": [
        {
          "id": "w1-effectiveness",
          "path": "evals/receipts/v1/immutable/w1-effectiveness.json",
          "sha256": "14ad3501396e57bd9f6b7e30a7f79f1a5873199858334dc9d3192c56589bf993"
        },
        {
          "id": "terminal-v5-effectiveness",
          "path": "evals/receipts/v1/immutable/terminal-v5-effectiveness.json",
          "sha256": "cd0b2d94a53e89de1ada561151ef3aed2c1db80ce4647468ccba9846429d6269"
        }
      ],
      "reasons": [
        "historical effectiveness evidence remains blocked and is not a positive product claim"
      ]
    }
  ],
  "overall_status": "pass"
}
